<?xml version="1.0" encoding="UTF-8" standalone="no"?>
<Metamodell xmlns="http://naep.divi.de/meta" xmlns:xsi="http://www.w3.org/2001/XMLSchema-instance" xsi:schemaLocation="http://naep.divi.de/meta ../xsd/naep-meta.xsd" schemaVersion="1.0" version="1.0">
	<Protokoll version="V.6.0-1.00-NoVar-01012021" />
	<Definitionen>
		<Fragen>
			<Antwort code="J" term="ja" />
			<Antwort code="N" term="nein" />
			<Antwort code="UB" term="unbekannt" />
			<Typ name="j_opt" optional="ja">
				<Antwort code="J" />
			</Typ>
			<Typ name="j-n" optional="nein">
				<Antwort code="J" />
				<Antwort code="N" />
			</Typ>
			<Typ name="j-n_opt" optional="ja">
				<Antwort code="J" />
				<Antwort code="N" />
			</Typ>
			<Typ name="j-n-ub" optional="nein">
				<Antwort code="J" />
				<Antwort code="N" />
				<Antwort code="UB" />
			</Typ>
		</Fragen>
	</Definitionen>
	<Abschnitte>
		<Abschnitt code="A01">
			<Titel>
				Patient - Stammdaten
			</Titel>
			<Formular>
				<Struktur code="A08">
					<xsi schemaLocation="http://naep.divi.de/strukturen/std naep-strukturen-std.xsd" type="PatStammdaten" />
					<Zusatz typ="einfach">
						<Auswahl code="A0F" term="Geschlecht" typ="einfach">
							<leer code="A0M" term="unbekannt" />
							<Option code="A0T" term="männlich" />
							<Option code="A10" term="weiblich" />
							<Option code="A11" term="divers" />
						</Auswahl>
						<Auswahl code="A17" term="BMI" typ="einfach">
							<Option code="A1E" term="&lt;=40" />
							<Option code="A1L" term="&gt;40" />
						</Auswahl>
						<oder code="A1S" term="Alter">
							<leer code="A1Z" term="unbekannt" />
							<Feld code="A26" einheit="Jahre" typ="Zahl" />
							<Auswahl code="A2D" typ="einfach">
								<Option code="A2K" term="1-7 Tage" />
								<Option code="A2R" term="8-28 Tage" />
							</Auswahl>
						</oder>
					</Zusatz>
				</Struktur>
			</Formular>
		</Abschnitt>
		<Abschnitt code="B01">
			<Titel>
				Einsatztechnische Daten
			</Titel>
			<Formular>
				<Struktur code="B08">
					<xsi schemaLocation="http://naep.divi.de/strukturen/std naep-strukturen-std.xsd" type="EinsatztechnischeDaten"/>
				</Struktur>
				<Feld code="B0F" term="Einsatz-Datum" typ="Datum" />
				<Struktur code="B0M" term="Einsatz-Ort">
					<xsi schemaLocation="http://naep.divi.de/strukturen/std naep-strukturen-std.xsd" type="Einsatzort"/>
					<Zusatz typ="einfach">
						<Auswahl code="B0T" typ="einfach">
							<Option code="B10" term="Wohnung" />
							<Option code="B17" term="Arztpraxis" />
							<Option code="B1E" term="öff. Raum" />
							<Option code="B1L" term="Bildungseinrichtung" />
							<Option code="B1S" term="Altenheim" />
							<Option code="B1Z" term="Krankenhaus" />
							<Option code="B26" term="Straße" />
							<Option code="B2D" term="Massenveranstaltung" />
							<Option code="B2K" term="Arbeitsplatz" />
							<Option code="B2R" term="Geburtshaus" />
							<Option code="B2Y" term="Schule" />
							<Option code="B35" term="Sportstätte" />
							<Sonstiges code="B3C" term="Sonstige" />
						</Auswahl>
					</Zusatz>
				</Struktur>
				<Auswahl code="B3J" term="Einsatz-Art" typ="einfach">
					<Option code="B3Q" term="Primäreinsatz" />
					<Option code="B3X" term="Folgeeinsatz" />
					<Option code="B44" term="Fehleinsatz">
						<Zusatz typ="einfach">
							<oder code="B4B">
								<Auswahl code="B4I" typ="einfach">
									<Option code="B4P" term="kein Patient" />
									<Option code="B4W" term="Pat. bereits abtransportiert" />
									<Option code="B53" term="abbestellt" />
									<Option code="B5A" term="böswillige Alarmierung" />
								</Auswahl>
								<Auswahl code="B5H" term="Einsatzabbruch" typ="einfach">
									<Option code="B5O" term="technische Gründe" />
									<Option code="B5V" term="Wetter" />
									<Sonstiges code="B62" term="Sonstige" />
								</Auswahl>
							</oder>
						</Zusatz>
					</Option>
					<Option code="B69" term="Notarzt-Nachforderung" />
					<Option code="B6G" term="Sekundäreinsatz z.B. Verlegung" />
					<Option code="B6N" term="vorsorgliche Bereitstellung" />
				</Auswahl>
				<Feld code="B6U" term="Transportziel" typ="Text">
					<Zusatz typ="einfach">
						<Frage code="B71" term="Voranmeldung" typ="j_opt">
							<wenn-ja>
								<Auswahl code="B78" typ="einfach">
									<Option code="B7F" term="Stroke Unit" />
									<Option code="B7M" term="Herzkatheter" />
									<Option code="B7T" term="Traumazentrum" />
								</Auswahl>
							</wenn-ja>
						</Frage>
					</Zusatz>
				</Feld>
				<Feld code="B80" term="Notarzt (Name)" typ="Text">
					<Zusatz typ="einfach">
						<Auswahl code="B87" term="Qualifikation" typ="einfach">
							<Option code="B8E" term="Arzt in Weiterb." />
							<Option code="B8L" term="Facharzt">
								<Zusatz typ="einfach">
									<Auswahl code="B8S" term="Qualifikation" typ="mehrfach">
										<Option code="B8Z" term="Anästhesie" />
										<Option code="B96" term="Chirurgie" />
										<Option code="B9D" term="Innere" />
										<Option code="B9K" term="Pädiatrie" />
										<Option code="B9R" term="Neurologie" />
										<Option code="B9Y" term="Allg. Medizin" />
										<Option code="B9Z" term="Klinische Akutmedizin" />
										<Option code="BA5" term="Zusatz Intensiv" />
										<Option code="BAC" term="Andere" />
									</Auswahl>
								</Zusatz>
							</Option>
						</Auswahl>
					</Zusatz>
				</Feld>
				<Feld code="BAJ" term="Assistenz" typ="Text">
					<Zusatz typ="einfach">
						<Auswahl code="BAQ" term="Höchste Qualifikation" typ="einfach">
							<Option code="BAX" term="Rett.Ass." />
							<Option code="BB4" term="Rett.San." />
							<Option code="BBB" term="Notfalll San." />
							<Option code="BBI" term="(Int.)Pfleg." />
						</Auswahl>
					</Zusatz>
				</Feld>
				<Feld code="BBP" term="RTW-Team" typ="Text" />
				<Feld code="BBW" term="Rufname eigenes Fahrzeug" typ="Text">
					<Hinweis>
						als "eigenes Fahrzeug" wird hier das den Notarzt zubringende (nicht das den Patienten schlusendlich transportierende) Rettungsmitel dokumentiert
					</Hinweis>
				</Feld>
				<Auswahl code="BC3" term="Beteiligte Rettungsmittel" typ="mehrfach">
					<Option code="BCA" term="NEF">
						<Zusatz typ="einfach">
							<Frage code="BCH" term="Selbstfahrer" typ="j_opt" />
						</Zusatz>
					</Option>
					<Option code="BCO" term="NAW" />
					<Option code="BCV" term="RTW" />
					<Option code="BD2" term="KTW" />
					<Option code="BD9" term="RTH" />
					<Option code="BDG" term="ITH" />
					<Option code="BDN" term="Bergrettung" />
					<Option code="TNA" term="TeleNA" />
					<Option code="BDU" term="Wasserrettung" />
					<Sonstiges code="BE1" term="Sonstige" />
				</Auswahl>
				<oder code="BE8">
					<Feld code="BEF" term="Symptom-Beginn" typ="Zeit" />
					<Frage code="BEM" term="vor über 24h" typ="j_opt" />
				    <Frage code="BUK" term="unbekannt" typ="j_opt" />
				</oder>
				<Frage code="BET" term="Kollaps beobachtet" typ="j_opt" />
				<Feld code="BF0" term="Alarm" typ="Zeit" />
				<Feld code="BF7" term="Ankunft (Einsatzort)" typ="Zeit" />
				<Feld code="BFE" term="Ankunft (am Pat.)" typ="Zeit">
					<Zusatz typ="einfach">
						<Frage code="BFL" term="vor Rettungsdienst" typ="j_opt" />
					</Zusatz>
				</Feld>
				<Feld code="BFS" term="Abfahrt" typ="Zeit" />
				<Feld code="BFZ" term="Übergabe" typ="Zeit" />
				<Feld code="BG6" term="Einsatzbereit" typ="Zeit" />
				<Feld code="BGD" term="Ende" typ="Zeit" />
			</Formular>
		</Abschnitt>
		<Abschnitt code="C01">
			<Titel>
				Notfallgeschehen, Anamnese, Erstbefund, Vormedikation, Vorbehandlung
			</Titel>
			<Formular>
				<Freitext code="C08" />
				<Auswahl code="C0F" term="AZ des Pat. vor dem Ereignis (entspr. ASA)" typ="einfach">
					<Option code="C0M" term="gesund" />
					<Option code="C0T" term="leicht eingeschränkt" />
					<Option code="C10" term="deutlich eingeschränkt" />
					<Option code="C1E" term="akut lebensgefährdet" />
					<Option code="C17" term="moribund" />
				</Auswahl>
				<Auswahl code="C30" term="Versorgungssituation">
					<Option code="C31" term="unabhängig" />
					<Option code="C32" term="Pflege zuhause" />
					<Option code="C33" term="Pflege in Instutition" />
				</Auswahl>
				<Auswahl code="C40" term="Antikoagulanzienmedikation (vor dem Ereignis)" typ="mehrfach">
					<Option code="C41" term="TZ-Aggregationshemmer" />
					<Option code="C42" term="VitK-Antagonist" />
					<Option code="C43" term="DOAK" />
					<Option code="C44" term="Heparin" />
					<Sonstiges code="C45" term="Sonstige" />
				</Auswahl>
				<Auswahl code="C1L" term="Ersthelfermaßnahmen (Laien)" typ="einfach">
					<leer code="C1S" term="keine" />
					<Option code="C1Z" term="suffizient" />
					<Option code="C26" term="insuffizient" />
				</Auswahl>
				<Frage code="C2D" term="First Responder vor Ort" typ="j_opt">
					<wenn-ja>
						<Feld code="C2K" term="ggf. Uhrzeit des Eintreffens" typ="Zeit" />
					</wenn-ja>
				</Frage>
				<!--
				<Auswahl code="AUTO" term="First Responder">
				<Option code="AUTO" term="vor Ort">
				<Zusatz>
				<Feld code="AUTO" term="ggf. Uhrzeit des Eintreffens" typ="Zeit"/>
				</Zusatz>
				</Option>
				</Auswahl>
				-->
				<Frage code="C2R" term="Besiedelung mit multiresistenten Keimen (MRSA, MRSE, ESBL etc) vorbekannt" typ="j_opt">
					<wenn-ja>
						<Auswahl code="C2Y" typ="mehrfach">
							<Option code="C35" term="abgedeckt" />
							<Option code="C3C" term="offen" />
						</Auswahl>
					</wenn-ja>
				</Frage>
				<!--
				<Auswahl code="AUTO">
				<Option code="AUTO" term="Besiedelung mit multiresistenten Keimen (MRSA, MRSE, ESBL etc) vorbekannt">
				<Zusatz>
				<Auswahl code="AUTO" typ="mehrfach">
				<Option code="AUTO" term="abgedeckt"/>
				<Option code="AUTO" term="offen"/>
				</Auswahl>
				</Zusatz>
				</Option>
				</Auswahl>
				-->
			</Formular>
		</Abschnitt>
		<Abschnitt code="D01">
			<Titel>
				Erstbefunde